index:ID,name,character,function,rule,:LABEL
https://cie.nwafu.edu.cn/2021-AAATKG/jujube/resource/R60001,枣树主要栽培管理技术,,,,枣树管理
https://cie.nwafu.edu.cn/2021-AAATKG/jujube/resource/R60002,枣树不同年龄时期的管理,枣树从栽植到结果、衰老、死亡，经历幼树生长期，生长结果期，盛果期，结果更新期，衰老期直至死亡的过程，称之为生命周期。,,必须深入了解枣树不同品种的生物学特性与不同年龄时期的特点，以及枣树生长发育对环境条件的要求，制定出科学的栽培技术措施，为枣树的良好生长发育创造各种有利条件， 达到早结果早受益，丰产稳产，延长经济结果年限，不断提高经济效益。,枣树管理
https://cie.nwafu.edu.cn/2021-AAATKG/jujube/resource/R60003,枣树不同物候期的管理,枣树从春季萌芽、展叶到夏季开花、结果、以至秋季采收、落叶、进入冬季休眠等的一年中经历许多物候期。,,,枣树管理
https://cie.nwafu.edu.cn/2021-AAATKG/jujube/resource/R60004,枣树病虫害防治,,,,枣树管理
https://cie.nwafu.edu.cn/2021-AAATKG/jujube/resource/R60005,整形修剪,整形修剪是果树整形与整枝的总称，也是枣树栽培中的一项重要技术措施。整形是根据枣的生物学特佳，通过人工辅助，在相当长的时间内，使枣树形成具有一定结构的丰产树形。整枝（剪枝）是人工调节枣树生长和结果的园艺技术措施。,合理地整形修剪，可控制树形，提高产量，提早结果，改善通风透光条件，延长经济结果寿命，减少病虫害，改善枣果品质，增强枣树的抗灾能力，降低 生产消耗，提高经济效益。,枣树层性强，排列规律，所以剪枝分量不大，操作容易。,枣树管理
https://cie.nwafu.edu.cn/2021-AAATKG/jujube/resource/R60006,土、肥、水管理,土肥水管理，是枣树优质丰产的基础。,科学的土肥水管理，能促进根系的生长，提高根系对水分和养分的吸收、合成和运转能力， 从而促进树体地上部的生长和结果，达到丰产优质的目的。,,枣树管理
https://cie.nwafu.edu.cn/2021-AAATKG/jujube/resource/R60007,花果管理技术,枣树花量很大，落花落果非常严重，自然坐果率一般仅1%左右。这主要是由于枣树花量大、物候期重叠严重、营养供应不足、花期恶劣气候条件等因素造成的。,,,枣树管理
https://cie.nwafu.edu.cn/2021-AAATKG/jujube/resource/R60008,树体其他管理技术,,,,枣树管理
https://cie.nwafu.edu.cn/2021-AAATKG/jujube/resource/R60009,枣树病虫害综合防治,病虫害防治是枣树生产上的关键环节。但不合理地施用化学农药，会不同程度地造成农药残留和环境污染。因此，在当今提倡食品安全生产的市场要求下，无害化、绿色化生产成为枣树栽培的又一主题。,,防治枣树病虫害，要全面贯彻“预防为主，综合防治"的植保方针，把病虫危害降低到最低限度。防治过程中，要根据病虫害发生规律，以农业和物理防治为基础，生物防治为核心，按照病虫害的发生规律和经济阈值，科学使用化学防治技术，以有效控制病虫的危害。,枣树管理
https://cie.nwafu.edu.cn/2021-AAATKG/jujube/resource/R60010,枣树主要树形及其特点,"枣树喜光，主要树形有自然圆头形、主干疏层形、开心形、“Y” 字形、扇形、柱形和篱壁形等。前两种树形适宜乔化大冠稀植栽培, 后几种树形适宜矮后几种树形适宜矮化密植栽培，各地可根据具体情况选用。",,,枣树管理
https://cie.nwafu.edu.cn/2021-AAATKG/jujube/resource/R60011,修剪方法,枣树的修剪方法，主要有短截、回缩、抹芽、摘心、疏枝、拉枝、撑枝、刻芽、环割、环剥、绞缢、落头、断根等。,,,枣树管理
https://cie.nwafu.edu.cn/2021-AAATKG/jujube/resource/R60012,修剪时期,枣树的修剪时期，一般分为休眠季修剪和生长季修剪夏剪。枣树修剪应以夏剪为主，冬剪为辅，冬剪和夏剪相结合。生产实践证明，夏剪比冬剪更重要。冬剪可一年不剪，但每年都要进行夏剪。,通过夏剪，有利于幼树早成形，早结果，有利于提高大树的产量和质量，同时可减轻病虫害，减少冬季修剪量。,,枣树管理
https://cie.nwafu.edu.cn/2021-AAATKG/jujube/resource/R60013,枣树整形修剪的原则和特点,,,,枣树管理
https://cie.nwafu.edu.cn/2021-AAATKG/jujube/resource/R60014,不同品种枣树的修剪特点,由于枣树品种间的生物学特性有差异，因此，各品种对修剪的反应也不一样。,较好地调控新生枝的数量，维持树势的均衡。,,枣树管理
https://cie.nwafu.edu.cn/2021-AAATKG/jujube/resource/R60015,放任枣树的整形修剪,放任枣园，一般是指管理水平极差或不加管理的枣园，每年至多只进行一些地下管理，由于缺乏修剪知识，很少修剪或从不修剪。一般树冠多呈乱头形，无层次，主侧不明，枝条紊乱，通风透光不良，大枝先端下垂，中下部二次枝干枯，结果 部位外移，病虫害滋生，产量低而不稳。,,对于这类放任生长的枣树不追求统一树形，应当本着“因树修剪，随树作形"的原则，重点解决树冠内部光照问题，控制发育枝营养生长过旺，更新各级骨干 枝和各类结果枝，变低产树为丰产树。,枣树管理
https://cie.nwafu.edu.cn/2021-AAATKG/jujube/resource/R60016,自然圆头形,这种树形是根据枣树在自然生长状态下的树形改进而来的。主要特点是成形快，通风透光良好，产量高，品质好。树体高大，没有一定层次。适用于树姿开张，干性中强的品种和稀植枣园。,,树体高大，没有一定层次。主枝6~8个，在主干上错落排开。每个主枝上着生2?3个侧枝，侧枝上着生结果枝组。,枣树管理
https://cie.nwafu.edu.cn/2021-AAATKG/jujube/resource/R60017,主干疏层形,也称疏散分层形。该树形的特点是，树冠呈圆锥形，骨架结构牢固，枝多，级次多，成形快，产量高，主枝分层排开，通风透光好。该树形适合栽培密度较小的中密度枣园和稀植枣园。对于发枝力较弱，特别是干性强、层性明显的 品种，如金丝小枣、骏枣、木枣、婆枣等尤为适用。,,全树有主枝6?8个，分2?3层。第一层有主枝3?4个，第二层有主枝2?3个，第三层有主枝1?2个.主枝基角为50°?60°。每主枝配备侧枝1?3个。第一、第二层间距离为70?100厘米，第二、第三层间距离为40?60厘米。,枣树管理
https://cie.nwafu.edu.cn/2021-AAATKG/jujube/resource/R60018,开心形,该树形树体较矮小，结构简单，树冠小，通风透光良好，结果枝较多，前期产量高。,,在树干上部着生3?4小主枝，以50°左右角向四周伸展，呈开心形。每个主枝的外侧着生2?3 个侧枝，结果枝组均匀地分布在主侧枝上。该树形适于萌芽力较强、分枝较多、干性弱的品种，如临猗梨枣、冬枣等。密植、稀植枣园均可应用。,枣树管理
https://cie.nwafu.edu.cn/2021-AAATKG/jujube/resource/R60019,“Y”字形,"“Y”字形是目前密植栽培枣园推广的主要树形之一。树冠矮小, 通风透光好，单株产量较小，但群体产量较高，早期效益好。",,在树干上部着生两个主枝，两个主枝斜伸向行间，枝基角为40°?60°。每个主枝上均匀着生2?3个结果枝组。,枣树管理
https://cie.nwafu.edu.cn/2021-AAATKG/jujube/resource/R60020,扇形,该树形树冠小，受光面积大，早期产量高，果实品质好，具有曲折上升的中心干，全树有主枝3?5个，均匀向两个相反方向生长。,,其树形扇面，可与行向垂直；也可有一定角度；主枝上基本不留侧枝，直接培养果枝组。此树形仅适于密植枣园的整形。,枣树管理
https://cie.nwafu.edu.cn/2021-AAATKG/jujube/resource/R60021,柱形,"该树形树体矮小，无大型骨干枝, 结够简单，无需专门整形，幼树结果早, 前期产量高。适于生长势较弱、多年生枝结果能力强的品种，是密植枣园常用的树形之—。",,全树具有中心干，没有明显的主侧枝，在主干上直接培养结果枝组，中心干保持直立，下部枝组较大，上部较小，全株有8?10个枝组。,枣树管理
https://cie.nwafu.edu.cn/2021-AAATKG/jujube/resource/R60022,短截,剪去当年生或1年生枣头或二次技的一部分的修剪方法叫短截。,,对枣头而言，短截有两种效应。一种是只对枣头一次枝短截，其剪口下的二次枝不动，剪口下主芽不萌发为枣头，俗称 “一剪子堵”，这种短截叫“堵截”。另一种是在对枣头一次枝短截的同时，将剪口下的第一个二次枝，从基部或留1?2个枣股后短截，剪口下主芽或二次枝枣股主芽，当年会萌发长成枣头，,枣树管理
https://cie.nwafu.edu.cn/2021-AAATKG/jujube/resource/R60023,回缩,剪去多年生单轴延伸的冗长枝、衰老枝、下垂枝和占据空间较大侧枝的一部分叫回缩。,其目的是使局部枝条更新复壮，抬高枝的角度，复壮树势，增强生长势和结果能力。,,枣树管理
https://cie.nwafu.edu.cn/2021-AAATKG/jujube/resource/R60024,抹芽,在萌芽期，把各级骨干枝及枝组上萌发出的无用幼芽，随萌发随从基部抹掉的方法叫抹芽。,减少不必要的营养消耗，有利于保持合理的树体结构，促进枣树的生长和产量的提高。,,枣树管理
https://cie.nwafu.edu.cn/2021-AAATKG/jujube/resource/R60025,摘心,在生长季，将新枝顶端幼嫩部分掐去的方法叫摘心。可分为枣头一次枝摘心、二次枝摘心和枣吊摘心。 ,"抑制枝条的加长生长，促进下部枝叶的生长, 提高树体的营养积累和转化水平，缓和新梢生长和开花坐果争夺养分的矛盾，提高坐果率。",枣头一次枝摘心，依其摘心强度的不同，可分为轻摘心、中摘心、重摘心和极重摘心四种。轻摘心，即在枣头长出5个以上永久性二次枝时摘心；中摘心，即在枣头长出3?5个永久性二次枝后摘心；重摘心，即在枣头长出其1?2个永久性二次枝时摘心；极重摘心，往往指只保留非永久性二次枝或基部枣吊的摘心。,枣树管理
https://cie.nwafu.edu.cn/2021-AAATKG/jujube/resource/R60026,疏枝,疏枝是指从基部剪除枝条的方法，在休眠季和生长季修剪都可 以进行疏枝。,疏除过密枝、交叉枝、重叠枝、并生枝、病虫枝、细弱枝等，以减少枝量，改善树体的光照条件，节约 营养，增强树势。,,枣树管理
https://cie.nwafu.edu.cn/2021-AAATKG/jujube/resource/R60027,拉枝、撑枝或缀枝,这是用人工的方法改变枝条生长方向的方法。用铁丝或绳子把枝条拉到一定角度后，固定于地上的方法叫拉枝；用做好的木棍直接把枝撑开到一定角度的方法叫撑枝。另外，改变枝角的方法还有缀枝。,拉枝、撑枝或缀枝，在幼树整形期间用得较多，主要目的是培养合理的树体结构，平衡树势和枝势。,,枣树管理
https://cie.nwafu.edu.cn/2021-AAATKG/jujube/resource/R60028,刻芽,刻芽又叫目伤，是在去掉2年生或多年生枝叶腋间主芽上方的二次枝后，用刀在主芽上方1?2厘米处刻一长1厘米左右、宽1?2 毫米的月牙形伤口，取下韧皮部，这种方法叫目伤。,促使主芽萌发新枣头。,,枣树管理
https://cie.nwafu.edu.cn/2021-AAATKG/jujube/resource/R60029,环剥或环割,环剥就是根据枝干的粗度，用刀从枝或干上剥下一圈宽度相当于枝粗或干径1/10的韧皮部，露出木质部的一种修剪方法。环割是在枝或干上用刀一圈或多圈割韧皮部深达木质部的一种修剪方法。,"一是用在萌芽前，在主芽上方部位环剥或环割主干或主枝，可以暂时切断芽体下方树体贮存营养向树体上部枝芽的运输和分散，从而促使剥口下部主芽的萌发。二是在花期环剥或环割，暂时阻断叶片光合产物向地下部的运输,从而集中供给开花坐果用，提高坐果率。花期环剥又叫开甲，一般在主干上进行。",,枣树管理
https://cie.nwafu.edu.cn/2021-AAATKG/jujube/resource/R60030,落头,"枣树树冠达到一定高度时，把中心干顶部向下回缩的一种方法, 称为落头。",,此法一方面可以控制树体高度；另一方面可以改善树冠内部的光照条件。,枣树管理
https://cie.nwafu.edu.cn/2021-AAATKG/jujube/resource/R60031,断根,这是一种特殊的修剪技术。,减缓幼旺树的营养生长，促进开花坐果。,,枣树管理
https://cie.nwafu.edu.cn/2021-AAATKG/jujube/resource/R60032,休眠季修剪,又称冬剪，是指在枣树落叶后到萌芽前期间所进行的剪截枝条工作。,调整部体结构，培养骨干枝，更新枝组,常用方法有：短截、疏枝、回缩、刻伤、变向等等。,枣树管理
https://cie.nwafu.edu.cn/2021-AAATKG/jujube/resource/R60033,生长季修剪,通常又叫夏剪。是指从枣树萌芽开始后的整个生长季内的修剪。 ,调节营养分配，平衡生长和结果的关系，减少落花落果，提高坐果率，改善光照条件，提高果实品质。,北方枣区主要有两个夏剪时期，第一次在4月下旬至5月上旬枣树萌芽期进行，修剪内容以疏枝和抹芽为主，将无用的枝条和萌芽及时疏剪、抹除，。第二次在5月下旬至6月中旬枣头生长高峰过后至盛花期间进行。修剪内容以疏枝、摘心与开张枝条角度为主。,枣树管理
https://cie.nwafu.edu.cn/2021-AAATKG/jujube/resource/R60034,整形修剪的依据,枣树修剪，必须依据枣树的生长结果特性、自然条件、栽培措施以及经济技术条件等进行。,,,枣树管理
https://cie.nwafu.edu.cn/2021-AAATKG/jujube/resource/R60035,整形修剪的原则,因地制宜，因树修剪，有形不死，无形不乱；依据当地的自然条件和生产需求，统筹兼顾，从解决主要矛盾出发，制定丰产、优质、低耗的修剪指标。,,,枣树管理
https://cie.nwafu.edu.cn/2021-AAATKG/jujube/resource/R60036,枣树整形修剪的特点及发展趋势,枣树整形修剪的特点，是由其生物学特性所决定的。枣树整形修剪的发展趋势是树冠由大变小，骨干枝由多变少；树形从自然形逐渐走向规范树形，从放任不剪到简单修剪，并逐步走向精细修剪，树体结构更趋合理；修剪时期从只注重休眠季修剪，开始转向休眠季修剪、生长季修剪相结合的修剪，或周年修剪。,,,枣树管理
https://cie.nwafu.edu.cn/2021-AAATKG/jujube/resource/R60037,生长结果特性,枣树品种之间树性差异较大，因此还应依据品种的生长结果特性制定修剪方案。不同年龄的枣树，一年中的不同时期，修剪也要有所侧重。,,,枣树管理
https://cie.nwafu.edu.cn/2021-AAATKG/jujube/resource/R60038,自然条件和栽培措施,在不同的自然条件、不同的栽培措施下，枣树往往也表现出不同的生长发育特性，修剪方法也应有所不同。,,,枣树管理
https://cie.nwafu.edu.cn/2021-AAATKG/jujube/resource/R60039,经济技术条件,经济技术条件好的地区，应进行精细修剪，以实现枣树的优质高效栽培的目的：而人工较少、技术缺乏的枣园，适于简化修剪。,,,枣树管理
https://cie.nwafu.edu.cn/2021-AAATKG/jujube/resource/R60040,因树修剪，随枝作形,"枣树的品种、树龄、立地条件和管理水平不同，对枣树的生长影响也不同。在整形修剪时，要根据枣树原有的基础和生长情况, “因树修剪，随枝作形”，不要“死搬硬套，强求树形”。",,,枣树管理
https://cie.nwafu.edu.cn/2021-AAATKG/jujube/resource/R60041,长短兼顾，轻重结合,枣树的结果早晚、产量高低、品质好坏和寿命长短，除与土肥水管理、病虫害防治等因素有关外，同整形修剪合理与否也有很大关系。,,"既要考虑当前效益，采取相应的技术措施，使其提早结果，提早受益,又要考虑长远效益，在提早结果，早期丰产的前提下，培养良好的树体结构，为获取长远高产稳产、优质高效和延长盛果期与树体寿命，奠定良好的基础。不能只为了眼前收益而采取不正确的技术措施，影响枣树的正常生长发育。",枣树管理
https://cie.nwafu.edu.cn/2021-AAATKG/jujube/resource/R60042,均衡树势，主从分明,根据枣树的具体生长情况，采取相应的技术措施，进行适当的疏剪和短截，使同层次各类枝条均衡发展，要明确枣树各类枝条之间的从属关系，使枣树骨干枝强于结果枝组，中央干强于主枝，主枝强于侧枝，同层次骨干枝生长势要基本平衡。当辅养枝和主侧枝生长发生矛盾时，辅养枝给主侧枝让路。,,,枣树管理
https://cie.nwafu.edu.cn/2021-AAATKG/jujube/resource/R60043,合理确定树形,根据每个树的具体情况，选用适当丰产树形。,,,枣树管理
https://cie.nwafu.edu.cn/2021-AAATKG/jujube/resource/R60044,选择培养骨干枝,,,选择角度大、位置适当、有侧枝和二次枝多的枝做主枝，锯除 2?3个严重遮光的与主枝并生的竞争枝和交叉枝等，打通光路，引光入膛。锯口最好涂抹石硫合剂渣等保护剂，防失水过多和病虫危害，促进伤口愈合。对留作主枝的大枝进行适当回缩，以抬高枝头角度，增强生长势；并用幼树整形的方法培养各级骨干枝的延长枝， 以形成具有良好树体结构的树冠；中心干过高、下部光秃无分枝的延长枝，应回缩落头，缩到有分枝的部位，使树冠开张，改善通风透光条件。,枣树管理
https://cie.nwafu.edu.cn/2021-AAATKG/jujube/resource/R60045,更新结果枝组,,,对放任树主枝改造后，还要疏除内膛的过密枝、并生枝、重叠枝、交叉枝、衰弱枝、干枯枝、病虫枝等，回缩细弱下垂枝与交叉枝，短截辅养枝，改造利用徒长枝，以培养健壮的结果枝组。一般对3年左右的枝要进行回缩，复壮其下部的二次枝及枣股，培养成结果枝组。对衰老枝要进行回缩更新，培养新枣头，使其形成结果枝组。,枣树管理
https://cie.nwafu.edu.cn/2021-AAATKG/jujube/resource/R60046,土壤管理,,枣园土壤管理的目的在于改善土壤的理化性状，创造适宜根系生长的环境条件，促进根系健壮生长，以充分发挥肥、水的增产效能，达到优质丰产高效。,,枣树管理
https://cie.nwafu.edu.cn/2021-AAATKG/jujube/resource/R60047,施肥,和其他作物一样，枣树生产中存在化肥使用过多的问题。虽然增加了产量，但引起果实品质和抗性的下降，同时对环境的污染也日趋严重。因此，在生产中要注意合理施肥。,,,枣树管理
https://cie.nwafu.edu.cn/2021-AAATKG/jujube/resource/R60048,灌水,枣树虽然抗旱性很强，但在生长季只有及时满足其对水分的需求，才能充分发挥其生产潜力。,有利于肥料的分解、吸收、利用和各种营养元素在体内的运转。,生产无公害和绿色枣果，必须使用经过有关部门测定水质合格（无污染）的水，不能用污水、未经处理的工业废水。,枣树管理
https://cie.nwafu.edu.cn/2021-AAATKG/jujube/resource/R60049,枣园土壤管理模式,枣园土壤管理模式，是指对枣树株间和行间的地表，进行管理的方法。,合理的土壤管理模式，有利于维持良好的土壤养分和水分供给状态，促进土壤结构的团粒化和有机质含量的提高，防止土壤和水分流失，保持适宜的土壤湿度。,,枣树管理
https://cie.nwafu.edu.cn/2021-AAATKG/jujube/resource/R60050,枣园土壤管理措施,,,,枣树管理
https://cie.nwafu.edu.cn/2021-AAATKG/jujube/resource/R60051,施肥时期,枣树生长期短，从萌芽到落叶，其生命活动极为活跃。在不同物候期内，有各自的营养分配中心。枣树生长期短，从萌芽到落叶，其生命活动极为活跃。在不同物候期内，有各自的营养分配中心。,,,枣树管理
https://cie.nwafu.edu.cn/2021-AAATKG/jujube/resource/R60052,肥料种类,枣园基肥应以有机肥为主，适当配合施入一些无机肥。追肥和叶面喷肥，主要是一些无机肥或微量元素等。,,,枣树管理
https://cie.nwafu.edu.cn/2021-AAATKG/jujube/resource/R60053,施肥方法,枣树的施肥方法，主要有土壤施肥和根外施肥两种。,,,枣树管理
https://cie.nwafu.edu.cn/2021-AAATKG/jujube/resource/R60054,施肥量,原则上大树多施、弱树多施、高产树多施，,,一般生产经验性施用量为：每产100千克鲜枣，约施入氮L 5 千克，磷1.0千克，钾1.1千克。幼树期间，由于根系少，追肥应少量多次，用量应逐年增加。成龄枣树根群庞大，一般可以考虑集中一次追肥。,枣树管理
https://cie.nwafu.edu.cn/2021-AAATKG/jujube/resource/R60055,山地枣园施肥的特点,山地丘陵枣园和旱堀枣园，由于灌水困难，追肥的时间不能照搬平原枣园的做法，而主要是趁雨追肥。另外，一定要重视秋季深翻施基肥，在生长季增加叶面喷肥次数，种植绿肥作物和客压杂草，以弥补有机肥的不足。同时大力推广穴贮肥水技术。,,,枣树管理
https://cie.nwafu.edu.cn/2021-AAATKG/jujube/resource/R60056,灌水时期,枣树在生长季对水分的要求是比较多的。,,从发芽到果实开始成熟，土壤水分以保持田间最大持水量的65%?70%为最好。,枣树管理
https://cie.nwafu.edu.cn/2021-AAATKG/jujube/resource/R60057,灌水方法,灌溉方法，除采用地面灌溉外，尽量采用滴灌、穴灌和地下管道等节水灌溉措施。,,有条件的枣园，应使用滴灌或微喷技术；没有条件的，要用水龙带引水沟灌。旱地果园可采用穴贮肥水法。为了节约用水，提高水的利用率，可在灌溉或下雨后，及时对全园覆盖地膜，以减少灌水次数。,枣树管理
https://cie.nwafu.edu.cn/2021-AAATKG/jujube/resource/R60058,灌水量,每次灌水量要以浸透根系分布层（40?60厘米）为准，达到田间最大持水量的60%?70%。,,,枣树管理
https://cie.nwafu.edu.cn/2021-AAATKG/jujube/resource/R60059,山地枣园的蓄水与灌水,水分缺乏是丘陵山区特别是北方丘陵山区枣树生产中的难题。 ,,北方雨水多集中在7、8、9月份三个月，生产中应切实注意雨水的截留和贮备。可以在枣园建蓄水池、蓄水窖等，利用地势截留雨水窖以便在枣树需水期使用。山地枣园的水分管理，主要是修建树盘和梯田等工程保蓄水，修建水窖和人工河湖（水库）供引水，覆盖地膜和中耕除草节水，以及客雪补水等。冬季客雪于树干基部，待雪融化后用塑料薄膜覆盖，其水分可维持到第二年的6?7月份。,枣树管理
https://cie.nwafu.edu.cn/2021-AAATKG/jujube/resource/R60060,清耕法,即在枣园内，除枣树外，不种植任何其他作物，并利用人工除草的方法清除地表的杂草，保持土地表面的疏松和裸露状态的一种耕作方法。,优点：可以改善土壤的通气性和透水性，促进土壤微生物繁殖和有机物的分解，增加土壤速效养分的含量；经常切断土壤毛细管，防止土壤水分蒸发；减少杂草对养分和水分的竞争。其缺点是长期清耕，会破坏土壤结构；使土壤有机质迅速分解而含量下降，导致土壤理化性状恶化；地表温度变化剧烈，加重水土和养分的流失。,,枣树管理
https://cie.nwafu.edu.cn/2021-AAATKG/jujube/resource/R60061,生草法,这是在枣园内除树盘外，在行间种植禾本科、豆科等草类的土壤管理方法。,生草法的优点是，能保持和改良土壤理化性状，增加土壤有机质和有效养分的含量；防止水土和养分流失；改善枣园地表小气候；促进果实成熟和枝条充实；降低土壤管理成本，有利于机械化作业。其缺点是，易造成草类与枣树的养分和水分争夺；长期生草易使表层土壤板结，影响通气；草类根系密度大，截取下渗水，消耗表层氮，导致枣树根系上浮。,在缺乏有机质、土层深厚、水土易流失的枣园，生草法是较好的土壤管理方法。枣园草种有三叶草、紫云英、黄豆、苕子、毛野豌豆、苦豆子、山绿豆、山扁豆、地丁、鸡眼草、草木樨、黑麦草、野燕麦等。选用窄叶草可节省水分，豆科和禾本科混种，对改良土壤有良好作用。,枣树管理
https://cie.nwafu.edu.cn/2021-AAATKG/jujube/resource/R60062,覆盖法,这是利用各种材料，如作物秸秆、杂草、薄膜、沙砾和淤泥等，对树盘、株间甚至整个行间进行覆盖的方法。,果园以覆草最为普遍，覆草厚度多为5?10厘米，其优点是，可以防止土壤水土流失和侵蚀；改善土壤结构和物理性状；抑制土壤水分的蒸发；调节地表温度，缩小地温的日变化和季节变化幅度；抑制杂草生长；防止返碱；积雪保墙；增加土壤有机质含量和有效态养分；促进枣树的吸收和生长。其缺点是，容易招致鼠害和虫害；长期覆盖还容易使根系上浮，在土壤水分急速减少时容易引起干旱。,,枣树管理
